<?xml version="1.0" encoding="UTF-8"?>
<!--Sample XML file generated by XMLSpy v2009 sp1 (http://www.altova.com)-->
<tmi8:VV_TM_PUSH xsi:schemaLocation="http://bison.connekt.nl/tmi8/kv19/msg kv19-msg.xsd" xmlns:tmi8c="http://bison.connekt.nl/tmi8/kv19/core" xmlns:tmi8="http://bison.connekt.nl/tmi8/kv19/msg" xmlns:xsi="http://www.w3.org/2001/XMLSchema-instance">
	<tmi8:SubscriberID>a</tmi8:SubscriberID>
	<tmi8:Version>a</tmi8:Version>
	<tmi8:DossierName>KV19forecast</tmi8:DossierName>
	<tmi8:Timestamp>2001-12-17T09:30:47Z</tmi8:Timestamp>
	<tmi8:KV19forecast>
		<tmi8:KV19JOURNEY>
			<tmi8:daowcode>DATAOWNERC</tmi8:daowcode>
			<tmi8:lineplanningnumber>LINEPLANNI</tmi8:lineplanningnumber>
			<tmi8:operatingday>2009-09-07</tmi8:operatingday>
			<tmi8:journeynumber>012345</tmi8:journeynumber>
			<tmi8:reinforcementnumber>99</tmi8:reinforcementnumber>
			<tmi8c:delimiter/>
			<extrastufformoretriprelatedkeyssortofthingie>gjgg</extrastufformoretriprelatedkeyssortofthingie>
		</tmi8:KV19JOURNEY>
		<tmi8:KV19EVENTS>
			<tmi8:ARRIVAL>
				<tmi8:userstopcode>USERSTOPC</tmi8:userstopcode>
				<tmi8:passagesequencenumber>1234</tmi8:passagesequencenumber>
				<tmi8:timestamp>2009-09-07T09:30:47Z</tmi8:timestamp>
				<tmi8:recordedarrivaltime>23:59:00</tmi8:recordedarrivaltime>
				<tmi8:expecteddeparturetime>23:59:15</tmi8:expecteddeparturetime>
				<tmi8c:delimiter since="vandaag090909"/>
				<junker/>
				<morejunker/>
				<novervalidatedafterdelimiter>dhdskhfdskfhdsfk</novervalidatedafterdelimiter>
			</tmi8:ARRIVAL>
			<tmi8:ASSIGNMENTPROPERTIES>
				<tmi8:userstopcode>USERSTOPCO</tmi8:userstopcode>
				<tmi8:passagesequencenumber>9999</tmi8:passagesequencenumber>
				<tmi8:timestamp>2001-12-17T09:30:47Z</tmi8:timestamp>
				<tmi8:wheelchairaccessible>ACCESSIBLE</tmi8:wheelchairaccessible>
				<tmi8:numberofcoaches>99</tmi8:numberofcoaches>
				<tmi8c:delimiter since="String"/>
			</tmi8:ASSIGNMENTPROPERTIES>
			<tmi8:ARRIVAL>
				<tmi8:userstopcode>USERSTOPCO</tmi8:userstopcode>
				<tmi8:passagesequencenumber>9999</tmi8:passagesequencenumber>
				<tmi8:timestamp>2001-12-17T09:30:47Z</tmi8:timestamp>
				<tmi8:recordedarrivaltime>0:00:00</tmi8:recordedarrivaltime>
				<tmi8:expecteddeparturetime>0:00:00</tmi8:expecteddeparturetime>
				<tmi8c:delimiter since="String"/>
			</tmi8:ARRIVAL>
			<tmi8:DEPARTURE>
				<tmi8:userstopcode>USERSTOPCO</tmi8:userstopcode>
				<tmi8:passagesequencenumber>9999</tmi8:passagesequencenumber>
				<tmi8:timestamp>2001-12-17T09:30:47Z</tmi8:timestamp>
				<tmi8:recordeddeparturetime>0:00:00</tmi8:recordeddeparturetime>
				<tmi8c:delimiter since="String"/>
			</tmi8:DEPARTURE>
			<tmi8:UPDATE>
				<tmi8:userstopcode>USERSTOPCO</tmi8:userstopcode>
				<tmi8:passagesequencenumber>9999</tmi8:passagesequencenumber>
				<tmi8:timestamp>2001-12-17T09:30:47Z</tmi8:timestamp>
				<tmi8:journeystoptype>FIRST</tmi8:journeystoptype>
				<tmi8:expectedarrivaltime>0:00:00</tmi8:expectedarrivaltime>
				<tmi8:expecteddeparturetime>0:00:00</tmi8:expecteddeparturetime>
			</tmi8:UPDATE>
			<tmi8:UPDATE>
				<tmi8:userstopcode>bbbbbbbbbb</tmi8:userstopcode>
				<tmi8:passagesequencenumber>000001</tmi8:passagesequencenumber>
				<tmi8:timestamp>2001-12-17T09:30:47Z</tmi8:timestamp>
				<tmi8:journeystoptype>FIRST</tmi8:journeystoptype>
				<tmi8:expectedarrivaltime>00:00:00</tmi8:expectedarrivaltime>
				<tmi8:expecteddeparturetime>0:00:00</tmi8:expecteddeparturetime>
				<tmi8c:delimiter since="String"/>
			</tmi8:UPDATE>
			<tmi8:SKIPPED>
				<tmi8:userstopcode>USERSTOPCO</tmi8:userstopcode>
				<tmi8:passagesequencenumber>9999</tmi8:passagesequencenumber>
				<tmi8:timestamp>2001-12-17T09:30:47Z</tmi8:timestamp>
				<tmi8c:delimiter since="String"/>
			</tmi8:SKIPPED>
			<tmi8:UPDATE>
				<tmi8:userstopcode>bbbbbbbbbb</tmi8:userstopcode>
				<tmi8:passagesequencenumber>000001</tmi8:passagesequencenumber>
				<tmi8:timestamp>2001-12-17T09:30:47Z</tmi8:timestamp>
				<tmi8:journeystoptype>FIRST</tmi8:journeystoptype>
				<tmi8:expectedarrivaltime>00:00:00</tmi8:expectedarrivaltime>
				<tmi8:expecteddeparturetime>0:00:00</tmi8:expecteddeparturetime>
				<tmi8c:delimiter since="String"/>
			</tmi8:UPDATE>
			<tmi8:HEARTBEAT>
				<tmi8:timestamp>2001-12-17T09:30:47Z</tmi8:timestamp>
				<tmi8c:delimiter since="String"/>
			</tmi8:HEARTBEAT>
			<tmi8:UNKNOWN>
				<tmi8:userstopcode>USERSTOPCO</tmi8:userstopcode>
				<tmi8:passagesequencenumber>9999</tmi8:passagesequencenumber>
				<tmi8:timestamp>2001-12-17T09:30:47Z</tmi8:timestamp>
				<tmi8c:delimiter since="String"/>
			</tmi8:UNKNOWN>
			<tmi8:UNKNOWN>
				<tmi8:userstopcode>a</tmi8:userstopcode>
				<tmi8:passagesequencenumber>9987</tmi8:passagesequencenumber>
				<tmi8:timestamp>2009-09-07T23:00:00Z</tmi8:timestamp>
			</tmi8:UNKNOWN>
			<tmi8c:delimiter since="String"/>
		</tmi8:KV19EVENTS>
	</tmi8:KV19forecast>
	<tmi8:KV19forecast>
		<tmi8:KV19JOURNEY>
			<tmi8:daowcode>a</tmi8:daowcode>
			<tmi8:lineplanningnumber>b</tmi8:lineplanningnumber>
			<tmi8:operatingday>2009-09-09</tmi8:operatingday>
			<tmi8:journeynumber>1</tmi8:journeynumber>
			<tmi8:reinforcementnumber>0</tmi8:reinforcementnumber>
		</tmi8:KV19JOURNEY>
	</tmi8:KV19forecast>
</tmi8:VV_TM_PUSH>
